{
  "$schema": "https://raw.githubusercontent.com/tablackburn/ai-agent-instruction-modules/main/schema.json",
  "version": "1.0.0",
  "profile": null,
  "modules": {
    "core/agent-workflow": true,
    "core/code-quality": true,
    "core/security": true,
    "languages/powershell": false,
    "languages/python": "awesome-copilot",
    "languages/typescript": {
      "source": "awesome-copilot",
      "sha256": "e3b0c44298fc1c149afbf4c8996fb92427ae41e4649b934ca495991b7852b855"
    },
    "practices/git-workflow": true,
    "tools/github-cli": false,
    "styles/markdown": true
  },
  "fallback": {
    "enabled": true,
    "source": "https://github.com/github/awesome-copilot",
    "branch": "main",
    "basePath": "instructions"
  },
  "customInstructionsPath": null
}
